[
 {
  "id": 1,
  "region": "Temporal",
  "sub": "Mesial Temporal (Amygdala / Hippocampus / Entorhinal Cortex)",
  "sign": "Epigastric rising aura",
  "phase": "Aura",
  "lat": "Non-lateralizing (slight ipsilateral tendency)",
  "latcode": "nonlat",
  "loc": "Amygdala, hippocampus, anterior insula (co-generator)",
  "sens": "40-50%",
  "spec": "~70% for TLE",
  "evid": "II",
  "notes": "Most common MTLE aura; rising sensation from epigastrium to chest/throat; anterior insular co-involvement confirmed by SEEG; can arise from insula alone",
  "cite": "Van Buren, Epilepsia 1963; Henkel et al., Epilepsia 2002; Palmini & Gloor 1992"
 },
 {
  "id": 2,
  "region": "Temporal",
  "sub": "Mesial Temporal (Amygdala / Hippocampus / Entorhinal Cortex)",
  "sign": "Fear aura",
  "phase": "Aura",
  "lat": "Non-lateralizing (slight ipsilateral; amygdala bilateral)",
  "latcode": "nonlat",
  "loc": "Basolateral amygdala (primary); ACC and anterior insula as co-generators",
  "sens": "30-40%",
  "spec": "~75% for MTLE",
  "evid": "I",
  "notes": "Ictal fear; direct amygdala stimulation elicits fear (Gloor); also from ACC and insula; intense, sudden, objectless fear; autonomic accompaniments common",
  "cite": "Gloor, Brain 1990; Feindel & Penfield 1954; Wieser 2004"
 },
 {
  "id": 3,
  "region": "Temporal",
  "sub": "Mesial Temporal (Amygdala / Hippocampus / Entorhinal Cortex)",
  "sign": "Deja vu",
  "phase": "Aura",
  "lat": "Ipsilateral (slight right > left)",
  "latcode": "ipsi",
  "loc": "Hippocampus, rhinal cortex (entorhinal + perirhinal cortex)",
  "sens": "15-20%",
  "spec": "~80% mesial TL",
  "evid": "I",
  "notes": "Familiarity illusion; more common from right mesial temporal; SEEG Bancaud confirmed rhinal cortex is key substrate (not purely hippocampal); Bartolomei stimulation study of rhinal cortex critical",
  "cite": "Bancaud et al., Brain 1994; Bartolomei et al., Neurology 2004"
 },
 {
  "id": 4,
  "region": "Temporal",
  "sub": "Mesial Temporal (Amygdala / Hippocampus / Entorhinal Cortex)",
  "sign": "Jamais vu",
  "phase": "Aura",
  "lat": "Ipsilateral",
  "latcode": "ipsi",
  "loc": "Hippocampus, entorhinal cortex",
  "sens": "5-10%",
  "spec": "~70%",
  "evid": "II",
  "notes": "Strangeness/unreality; unfamiliarity illusion; overlaps with derealization; less common than deja vu; may co-occur with deja vu as oscillating familiarity state",
  "cite": "Bancaud et al., Brain 1994; Gloor 1990"
 },
 {
  "id": 5,
  "region": "Temporal",
  "sub": "Mesial Temporal (Amygdala / Hippocampus / Entorhinal Cortex)",
  "sign": "Olfactory aura (uncinate fit)",
  "phase": "Aura",
  "lat": "Ipsilateral",
  "latcode": "ipsi",
  "loc": "Amygdala (primary), piriform cortex, uncus; OFC as secondary",
  "sens": "10-15%",
  "spec": "~75% TLE",
  "evid": "II",
  "notes": "Classic Jacksonian uncinate fit; typically unpleasant or burning; SEEG: piriform-amygdalar origin; OFC stimulation also elicits olfactory hallucination (may be more pleasant quality)",
  "cite": "Jackson, Brain 1889; Daly 1958; Murai et al. 1997"
 },
 {
  "id": 6,
  "region": "Temporal",
  "sub": "Mesial Temporal (Amygdala / Hippocampus / Entorhinal Cortex)",
  "sign": "Gustatory aura",
  "phase": "Aura",
  "lat": "Variable (ipsilateral tendency)",
  "latcode": "variable",
  "loc": "Amygdala (input pathway); primary substrate = anterior insula + parietal operculum (area 43)",
  "sens": "5-10%",
  "spec": "Moderate",
  "evid": "II",
  "notes": "Metallic or unpleasant taste hallucination; amygdala receives gustatory input but primary cortical substrate is insular-opercular; SEEG: Hausser-Hauw & Bancaud established insular-opercular primacy",
  "cite": "Hausser-Hauw & Bancaud, Brain 1987; Siegel 1999; Isnard et al. 2000"
 },
 {
  "id": 7,
  "region": "Temporal",
  "sub": "Mesial Temporal (Amygdala / Hippocampus / Entorhinal Cortex)",
  "sign": "Experiential / memory flashback aura (panoramic)",
  "phase": "Aura",
  "lat": "Non-lateralizing (slight right tendency)",
  "latcode": "nonlat",
  "loc": "Lateral temporal neocortex (STG/MTG) + hippocampus co-activation required",
  "sens": "5-10%",
  "spec": "~70%",
  "evid": "II",
  "notes": "Vivid autobiographical replay; Penfield interpretive cortex; SEEG shows lateral temporal neocortex + hippocampal co-activation required; cannot arise from hippocampus alone; right temporal more common for experiential auras",
  "cite": "Penfield & Perot, Brain 1963; Gloor 1990; Bancaud et al. 1994"
 },
 {
  "id": 8,
  "region": "Temporal",
  "sub": "Mesial Temporal (Amygdala / Hippocampus / Entorhinal Cortex)",
  "sign": "Motionless stare / ictal behavioral arrest (hypomotor onset)",
  "phase": "Ictal",
  "lat": "Non-lateralizing",
  "latcode": "nonlat",
  "loc": "Mesial temporal (bilateral hippocampal involvement for impaired consciousness)",
  "sens": "80-90%",
  "spec": "Low (also frontal, parietal)",
  "evid": "I",
  "notes": "Classic early MTLE sign; impaired consciousness with motionless stare; bilateral hippocampal spread required for unconsciousness; duration >30s helps distinguish from absence; highly sensitive for TLE but non-lateralizing",
  "cite": "Kotagal et al., Epilepsy Res 1995; Bleasel et al., Epilepsia 1997"
 },
 {
  "id": 9,
  "region": "Temporal",
  "sub": "Mesial Temporal (Amygdala / Hippocampus / Entorhinal Cortex)",
  "sign": "Oral automatisms (lip smacking, chewing, swallowing, licking)",
  "phase": "Ictal",
  "lat": "Ipsilateral to EZ",
  "latcode": "ipsi",
  "loc": "Mesial temporal (amygdalo-hippocampal complex) -> orbitofrontal propagation",
  "sens": "45-60%",
  "spec": "70-75%",
  "evid": "I",
  "notes": "Among most studied automatisms; ipsilateral to EZ; oral > manual in pure MTLE; SEEG confirms amygdalo-hippocampal origin with OFC propagation; chewing rate may encode propagation speed",
  "cite": "Kotagal et al., Epilepsy Res 1995; Bleasel et al., Epilepsia 1997; Williamson 1985"
 },
 {
  "id": 10,
  "region": "Temporal",
  "sub": "Mesial Temporal (Amygdala / Hippocampus / Entorhinal Cortex)",
  "sign": "Unilateral manual automatisms (ipsilateral fumbling, picking, patting)",
  "phase": "Ictal",
  "lat": "Ipsilateral to EZ",
  "latcode": "ipsi",
  "loc": "Mesial temporal; contralateral limb may simultaneously show dystonia",
  "sens": "40-50%",
  "spec": "65-70%",
  "evid": "I",
  "notes": "Ipsilateral hand automatisms; KEY: automatisms ipsilateral while contralateral arm often shows dystonic posturing (complementary sign); combined AP sign = highest specificity; complex unilateral hand movements",
  "cite": "Kotagal et al., Epilepsy Res 1995; Bleasel et al., Epilepsia 1997"
 },
 {
  "id": 11,
  "region": "Temporal",
  "sub": "Mesial Temporal (Amygdala / Hippocampus / Entorhinal Cortex)",
  "sign": "Contralateral dystonic limb posturing",
  "phase": "Ictal",
  "lat": "CONTRALATERAL - HIGHEST SPECIFICITY SIGN IN TLE",
  "latcode": "contra",
  "loc": "EZ in ipsilateral mesial temporal; mechanism via temporal->subthalamic->basal ganglia loop producing contralateral inhibition/dystonia",
  "sens": "35-45%",
  "spec": "90-95%",
  "evid": "I",
  "notes": "GOLD STANDARD lateralizer; tonic writhing/dystonic posture of contralateral limb; BG-mediated via subthalamic pathway; seminal Kotagal 1989 paper; arm > leg; combination with ipsilateral automatisms (AP sign) approaches 100% PPV",
  "cite": "Kotagal et al., Neurology 1989; Marks & Laxer 1998; Bleasel et al. 1997; O'Brien et al., Brain 1996"
 },
 {
  "id": 12,
  "region": "Frontal",
  "sub": "DLPFC / Premotor / Frontal Eye Field (Brodmann 6/8/9/46)",
  "sign": "Late forced/tonic head version (>30s, sustained, contralateral)",
  "phase": "Ictal",
  "lat": "CONTRALATERAL to EZ (late + tonic = contra)",
  "latcode": "contra",
  "loc": "Frontal eye field (FEF, Brodmann 8) / premotor cortex; arises from FEF onset or from temporal/occipital propagation to the frontal contraversive fields",
  "sens": "35-45%",
  "spec": "80-85%",
  "evid": "I",
  "notes": "KEY DISTINCTION: late (>30s), forced, sustained tonic deviation = CONTRALATERAL; reflects seizure spread to FEF; immediately pre-GTCS versive turn is most reliable; Wyllie 1986 seminal paper",
  "cite": "Wyllie et al., Neurology 1986; Robillard et al., Neurology 1983; Ochs et al., Neurology 1984"
 },
 {
  "id": 13,
  "region": "Temporal",
  "sub": "Mesial Temporal (Amygdala / Hippocampus / Entorhinal Cortex)",
  "sign": "Early non-forced head turning (<30s, ipsilateral, exploratory)",
  "phase": "Ictal",
  "lat": "IPSILATERAL to EZ (early + non-forced = ipsi)",
  "latcode": "ipsi",
  "loc": "Temporal lobe ictal onset zone (orienting/searching behavior)",
  "sens": "30-40%",
  "spec": "~65%",
  "evid": "II",
  "notes": "CRITICAL DISTINCTION: early (<30s), non-forced, exploratory head turn toward EZ side; ictal orienting behavior; lower specificity than late versive; must be distinguished from late tonic version; Chee group confirmation",
  "cite": "Wyllie et al., Neurology 1986; Chee et al., Epilepsia 1993; Robillard et al. 1983"
 },
 {
  "id": 14,
  "region": "Temporal",
  "sub": "Mesial Temporal (Amygdala / Hippocampus / Entorhinal Cortex)",
  "sign": "Figure-of-4 sign (extended arm + flexed arm asymmetric tonic)",
  "phase": "Ictal",
  "lat": "CONTRALATERAL - extended arm = contralateral to EZ",
  "latcode": "contra",
  "loc": "Motor cortex propagation from temporal or frontal EZ; asymmetric bilateral motor involvement",
  "sens": "~40%",
  "spec": "~95%",
  "evid": "I",
  "notes": "Extended arm = contralateral to EZ; observed during tonic phase of GTCS evolution; very high specificity; distinct from bilateral asymmetric tonic seizure (BATS); both arms form figure-4 posture; landmark Kotagal paper",
  "cite": "Kotagal et al., Epilepsia 2000; Vendrame et al., Epilepsy Behav 2010"
 },
 {
  "id": 15,
  "region": "Temporal",
  "sub": "Mesial Temporal (Amygdala / Hippocampus / Entorhinal Cortex)",
  "sign": "Automatism + contralateral posturing combined (AP sign)",
  "phase": "Ictal",